Second Keyword,Full Command Example,Description/Achievement,To Implement?,Keyword,Implemented?,Redirect Link,Test Success?,Test Comment
workflow rule {Object},create workflow rule Case,Create new workflow rule for object,FALSE,create,FALSE,,,
sharing rule {Object},create sharing rule Lead,Create new sharing rule for object,FALSE,create,FALSE,,,
duplicate rule {Object},create duplicate rule Contact,Create new duplicate rule for object,FALSE,create,FALSE,,,
matching rule {Object},create matching rule Lead,Create new matching rule for object,FALSE,create,FALSE,,,
change set,create change set,Create new outbound change set,FALSE,create,FALSE,,,
user {Query},search user john,Search for users by name or email,FALSE,search,FALSE,,,
record {Object} {Query},search record Account Acme,Search records in specific object,FALSE,search,FALSE,,,
field {Query},search field email,Search for fields across all objects,FALSE,search,FALSE,,,
apex {Query},search apex AccountController,Search Apex classes and triggers,FALSE,search,FALSE,,,
flow {Query},search flow account,Search flows by name,FALSE,search,FALSE,,,
report {Query},search report sales,Search reports by name,FALSE,search,FALSE,,,
dashboard {Query},search dashboard executive,Search dashboards by name,FALSE,search,FALSE,,,
metadata {Query},search metadata validation,Search metadata components,FALSE,search,FALSE,,,
global {Query},search global acme,Global search across Salesforce,FALSE,search,FALSE,,,
user {Username},edit user john@example.com,Open user edit page,FALSE,edit,FALSE,,,
record {Object} {ID},edit record Account 001XXXXXXXXXXXX,Open record edit page,FALSE,edit,FALSE,,,
field {Object}.{Field},edit field Account.Industry,Edit field metadata,FALSE,edit,FALSE,,,
object {Object},edit object CustomObject__c,Edit object metadata,FALSE,edit,FALSE,,,
profile {Name},edit profile System Administrator,Edit profile settings,FALSE,edit,FALSE,,,
permission set {Name},edit permission set API_Access,Edit permission set,FALSE,edit,FALSE,,,
flow {Name},edit flow Account_Creation,Open flow in edit mode,FALSE,edit,FALSE,,,
validation rule {Object} {Name},edit validation rule Account Min_Revenue,Edit validation rule,FALSE,edit,FALSE,,,
workflow rule {Object} {Name},edit workflow rule Case Auto_Assign,Edit workflow rule,FALSE,edit,FALSE,,,
page layout {Object} {Layout},edit page layout Contact Standard,Edit page layout,FALSE,edit,FALSE,,,
field {Object}.{Field},delete field Account.OldField__c,Delete field with safety checks,FALSE,delete,FALSE,,,
record {Object} {ID},delete record Account 001XXXXXXXXXXXX,Delete specific record,FALSE,delete,FALSE,,,
user {Username},delete user test@example.com,Deactivate user (safety check),FALSE,delete,FALSE,,,
validation rule {Object} {Name},delete validation rule Account Test_Rule,Delete validation rule,FALSE,delete,FALSE,,,
flow {Name},delete flow Old_Process_Flow,Delete flow (with dependency check),FALSE,delete,FALSE,,,
apex class {Name},delete apex class OldController,Delete Apex class (with dependency check),FALSE,delete,FALSE,,,
user {Username},clone user john@example.com,Clone user and permissions to new user,FALSE,clone,FALSE,,,
profile {Name},clone profile Standard User,Clone profile to create new one,FALSE,clone,FALSE,,,
permission set {Name},clone permission set Developer_Access,Clone permission set,FALSE,clone,FALSE,,,
record {Object} {ID},clone record Opportunity 006XXXXXXXXXXXX,Clone record with prepopulated fields,FALSE,clone,FALSE,,,
page layout {Object} {Layout},clone page layout Account Standard,Clone page layout,FALSE,clone,FALSE,,,
flow {Name},clone flow Lead_Conversion,Clone existing flow,FALSE,clone,FALSE,,,
permissions {Username},analyze permissions john@example.com,Analyze user's effective permissions,FALSE,analyze,FALSE,,,
limits,analyze limits,Show org limits usage and capacity,FALSE,analyze,FALSE,,,
dependencies {Object/Field},analyze dependencies Account.CustomField__c,Show where field/object is used,FALSE,analyze,FALSE,,,
api usage,analyze api usage,Show API usage statistics,FALSE,analyze,FALSE,,,
storage,analyze storage,Show data and file storage usage,FALSE,analyze,FALSE,,,
security,analyze security,Run security health check,FALSE,analyze,FALSE,,,
performance {Object},analyze performance Account,Show performance metrics for object,FALSE,analyze,FALSE,,,
apex {Code},run apex System.debug('test'),Execute anonymous Apex code,FALSE,run,FALSE,,,
soql {Query},run soql SELECT Id FROM Account,Execute SOQL query,FALSE,run,FALSE,,,
flow {Name},run flow Test_Flow,Execute flow for testing,FALSE,run,FALSE,,,
test {Class},run test AccountControllerTest,Run specific Apex test class,FALSE,run,FALSE,,,
all tests,run all tests,Run all Apex tests in org,FALSE,run,FALSE,,,
data {Object},export data Account,Export data from object to CSV,FALSE,export,FALSE,,,
metadata {Type},export metadata ApexClass,Export metadata of specific type,FALSE,export,FALSE,,,
report {Name},export report Sales_Pipeline,Export report data,FALSE,export,FALSE,,,
users,export users,Export user list with details,FALSE,export,FALSE,,,
sandboxes,compare sandboxes,Compare metadata between sandboxes,FALSE,compare,FALSE,,,
fields {Object},compare fields Account,Compare fields across orgs,FALSE,compare,FALSE,,,
profiles {Name1} {Name2},compare profiles Admin vs User,Compare two profiles side by side,FALSE,compare,FALSE,,,
data {Object},import data Account,Import data into object from CSV,FALSE,import,FALSE,,,
metadata,import metadata,Import metadata from package,FALSE,import,FALSE,,,
permission set {Name} {User},assign permission set API_Access john@example.com,Assign permission set to user,FALSE,assign,FALSE,,,
profile {Name} {User},assign profile Developer john@example.com,Assign profile to user,FALSE,assign,FALSE,,,
change set {Name},deploy change set Feature_v1,Deploy inbound change set,FALSE,deploy,FALSE,,,
metadata,deploy metadata,Deploy metadata from package,FALSE,deploy,FALSE,,,
sandbox {Name},refresh sandbox UAT,Refresh specific sandbox,FALSE,refresh,FALSE,,,
flow {Name},activate flow Account_Process,Activate a flow,FALSE,activate,FALSE,,,
flow {Name},deactivate flow Old_Process,Deactivate a flow,FALSE,deactivate,FALSE,,,
validation rule {Object} {Name},activate validation rule Account Revenue_Check,Activate validation rule,FALSE,activate,FALSE,,,
validation rule {Object} {Name},deactivate validation rule Account Test_Rule,Deactivate validation rule,FALSE,deactivate,FALSE,,,
user {Username},freeze user contractor@example.com,Freeze user account,FALSE,freeze,FALSE,,,
user {Username},unfreeze user contractor@example.com,Unfreeze user account,FALSE,unfreeze,FALSE,,,
password {Username},reset password john@example.com,Reset user password and send email,FALSE,reset,FALSE,,,
login access {Username},grant login access john@example.com,Grant login access to user,FALSE,grant,FALSE,,,
apex {Class/Trigger},debug apex AccountTrigger,Set up debug logging for Apex,FALSE,debug,FALSE,,,
flow {Name},debug flow Account_Creation,Enable debug mode for flow,FALSE,debug,FALSE,,,
api,monitor api,Open API usage monitoring dashboard,FALSE,monitor,FALSE,,,
jobs,monitor jobs,Open Apex jobs monitoring,FALSE,monitor,FALSE,,,
limits,monitor limits,Monitor org limits in real-time,FALSE,monitor,FALSE,,,
dependencies {Component},view dependencies CustomField__c,View component dependencies,FALSE,view,FALSE,,,
usage {Component},view usage AccountTrigger,View where component is used,FALSE,view,FALSE,,,
history {Object} {ID},view history Account 001XXXXXXXXXXXX,View record field history,FALSE,view,FALSE,,,
setup audit trail,view setup audit trail,View setup audit trail,FALSE,view,FALSE,,,
metadata,backup metadata,Export all metadata for backup,FALSE,backup,FALSE,,,
metadata {Backup},restore metadata 2024-05-01,Restore metadata from backup,FALSE,restore,FALSE,,,
apex {Class},schedule apex BatchProcess,Schedule Apex class execution,FALSE,schedule,FALSE,,,
flow {Name},schedule flow Daily_Update,Schedule flow execution,FALSE,schedule,FALSE,,,
log {ID},download log 07LXXXXXXXXXXXX,Download debug log file,FALSE,download,FALSE,,,
debug logs,clear debug logs,Clear all debug logs,FALSE,clear,FALSE,,,